{"schemaVersion":1,"page":{"number":71,"id":"grammar-master-0071","title":"複数形は、音と形で変わる","image":"pages/PAGE_0071.webp","sourcePrompt":"source-prompts/PAGE_0071.txt"},"analysis":{"summaryJa":"英語の複数形は単純に-sを付けるだけではなく、語尾の綴りに応じて-es、子音字+y→ies、一部の-f/-fe→vesなどへ変化し、person→peopleのような不規則形やdeerのような単複同形もある。また綴りの-s/-esは発音では[s]・[z]・[iz]に分かれ、newsのように-sで終わっても単数扱いの語もあるため、形・音・一致を分けて判断する。","grammarPoints":["通常の可算名詞は複数で-sを付ける","-s/-sh/-ch/-xなどで終わる語は一般に-esを付ける","子音字+yはyをiesに変えるが、母音字+yでは通常-sを付ける","一部の-f/-fe語は-vesに変化する","person→peopleなどの不規則複数とdeerなどの単複同形を覚える","複数語尾は環境により[s]・[z]・[iz]と発音される","newsのように-s語尾でも単数扱いの語がある"],"visualEvidence":["単数名詞ブロックが複数形の鍛冶場で複数ルートへ変形する図","city→cities、shelf→shelves、person→people、deer→deerの対比","[s]・[z]・[iz]の音バッジ","規則変化・不規則変化・単複同形を別の門で整理する構図","-sで終わる見た目だけでは数を判断できないという注意"],"commonTraps":["citysやcompanysのように子音字+yへ単純に-sを付ける","boxsやbranchsのように-esが必要な語を見落とす","shelfをshelfsと機械的にする","personをpeoples、deerをdeersとする","newsを複数主語だと思ってareを使う","複数-sの綴りを見て発音も常に[s]だと思う"]},"questions":[{"id":"PAGE_0071_Q01","format":"part5-cloze","prompt":"Three regional ------- submitted proposals for the conference venue.","choices":{"A":"citys","B":"cityes","C":"cities","D":"city"},"correctAnswer":"C","translationJa":"3つの地方都市が会議会場の提案を提出しました。","explanationJa":"cityは子音字+yで終わるため、複数形はyをiesに変えてcitiesです。","focus":"子音字+y → ies","difficulty":"basic"},{"id":"PAGE_0071_Q02","format":"part5-cloze","prompt":"The archive stores several wooden ------- from the former library.","choices":{"A":"shelves","B":"shelfs","C":"shelvs","D":"shelfes"},"correctAnswer":"A","translationJa":"その資料室には旧図書館の木製棚がいくつか保管されています。","explanationJa":"shelfは複数形でfがvesに変わる語なのでshelvesが適切です。","focus":"一部の-f → ves","difficulty":"basic"},{"id":"PAGE_0071_Q03","format":"part5-cloze","prompt":"Two ------- from the legal department will attend the client meeting.","choices":{"A":"persons","B":"peoples","C":"person","D":"people"},"correctAnswer":"D","translationJa":"法務部から2人が顧客会議に出席します。","explanationJa":"personの通常の複数形は不規則変化のpeopleです。","focus":"person → people","difficulty":"basic"},{"id":"PAGE_0071_Q04","format":"part5-cloze","prompt":"The delivery included six cardboard ------- for the display materials.","choices":{"A":"boxs","B":"boxes","C":"boxies","D":"box"},"correctAnswer":"B","translationJa":"配送品には展示資料用の段ボール箱が6個含まれていました。","explanationJa":"boxは-xで終わるため複数形は-esを付けてboxesです。","focus":"-x + es","difficulty":"intermediate"},{"id":"PAGE_0071_Q05","format":"part5-cloze","prompt":"Several new ------- opened near the station this year.","choices":{"A":"branches","B":"branchs","C":"branchies","D":"branch"},"correctAnswer":"A","translationJa":"今年、駅の近くに新しい支店がいくつか開設されました。","explanationJa":"branchは-chで終わるため-esを付けてbranchesにします。","focus":"-ch + es","difficulty":"intermediate"},{"id":"PAGE_0071_Q06","format":"part5-cloze","prompt":"The technician labeled all of the backup ------- before shipment.","choices":{"A":"copys","B":"copyes","C":"copies","D":"copy"},"correctAnswer":"C","translationJa":"技術者は出荷前にすべてのバックアップコピーへラベルを付けました。","explanationJa":"copyは子音字+yなのでyをiesに変えてcopiesです。","focus":"子音字+yの複数形","difficulty":"intermediate"},{"id":"PAGE_0071_Q07","format":"part5-cloze","prompt":"The park manager reported that several ------- were near the road at dawn.","choices":{"A":"deers","B":"deer","C":"deeres","D":"deeries"},"correctAnswer":"B","translationJa":"公園管理者は夜明けに道路近くに数頭のシカがいたと報告しました。","explanationJa":"deerは単数形と複数形が同じです。","focus":"単複同形deer","difficulty":"intermediate"},{"id":"PAGE_0071_Q08","format":"part5-cloze","prompt":"The safety notice says the latest ------- is available on the staff portal.","choices":{"A":"news are","B":"news were","C":"new are","D":"news is"},"correctAnswer":"D","translationJa":"安全通知には最新情報がスタッフ用ポータルで確認できると書かれています。","explanationJa":"newsは-sで終わりますが単数扱いなのでnews isが適切です。","focus":"-s語尾でも単数のnews","difficulty":"intermediate"},{"id":"PAGE_0071_Q09","format":"part5-cloze","prompt":"In the word “reports,” the final -s is pronounced -------.","choices":{"A":"[iz]","B":"[z]","C":"[s]","D":"[es]"},"correctAnswer":"C","translationJa":"reportsの語末-sは[s]と発音されます。","explanationJa":"無声音/t/の後の複数語尾-sは通常[s]になります。","focus":"複数語尾の発音[s]","difficulty":"advanced"},{"id":"PAGE_0071_Q10","format":"part5-cloze","prompt":"In the word “badges,” the plural ending is pronounced -------.","choices":{"A":"[s]","B":"[iz]","C":"[z]","D":"[d]"},"correctAnswer":"B","translationJa":"badgesの複数語尾は[iz]と発音されます。","explanationJa":"歯擦音・破擦音に近い語尾の後では複数語尾が1音節増えて[iz]になります。","focus":"複数語尾の発音[iz]","difficulty":"advanced"},{"id":"PAGE_0071_Q11","format":"correct-sentence","prompt":"Choose the sentence with the correct plural of “city.”","choices":{"A":"Three citys joined the program.","B":"Three cityes joined the program.","C":"Three city joined the program.","D":"Three cities joined the program."},"correctAnswer":"D","translationJa":"3つの都市がそのプログラムに参加しました。","explanationJa":"cityは子音字+yなのでcitiesが正しい複数形です。","focus":"city → cities","difficulty":"basic"},{"id":"PAGE_0071_Q12","format":"correct-sentence","prompt":"Choose the sentence with the correct plural of “shelf.”","choices":{"A":"The storeroom has four shelfs.","B":"The storeroom has four shelves.","C":"The storeroom has four shelfes.","D":"The storeroom has four shelvs."},"correctAnswer":"B","translationJa":"倉庫には棚が4つあります。","explanationJa":"shelfは複数形でshelvesとなる不規則寄りの-f/-ves変化です。","focus":"shelf → shelves","difficulty":"basic"},{"id":"PAGE_0071_Q13","format":"correct-sentence","prompt":"Choose the sentence with the correct plural of “person.”","choices":{"A":"Two people are waiting in reception.","B":"Two personses are waiting in reception.","C":"Two peoples are waiting in reception.","D":"Two person is waiting in reception."},"correctAnswer":"A","translationJa":"受付で2人が待っています。","explanationJa":"一般的なpersonの複数形はpeopleです。","focus":"person → people","difficulty":"intermediate"},{"id":"PAGE_0071_Q14","format":"correct-sentence","prompt":"Choose the sentence with the correct plural of “box.”","choices":{"A":"The shipment contains five boxs.","B":"The shipment contains five boxies.","C":"The shipment contains five boxes.","D":"The shipment contains five box."},"correctAnswer":"C","translationJa":"その発送品には箱が5個入っています。","explanationJa":"-xで終わるboxは-esを付けてboxesにします。","focus":"box → boxes","difficulty":"intermediate"},{"id":"PAGE_0071_Q15","format":"correct-sentence","prompt":"Choose the sentence with the correct plural of “company.”","choices":{"A":"Several companys applied.","B":"Several companies applied.","C":"Several companyes applied.","D":"Several company applied."},"correctAnswer":"B","translationJa":"複数の会社が応募しました。","explanationJa":"companyは子音字+yなのでcompaniesになります。","focus":"company → companies","difficulty":"intermediate"},{"id":"PAGE_0071_Q16","format":"correct-sentence","prompt":"Choose the sentence showing a noun whose singular and plural forms are the same.","choices":{"A":"Three deers crossed the road.","B":"Three deeres crossed the road.","C":"Three deer is crossing the road.","D":"Three deer crossed the road."},"correctAnswer":"D","translationJa":"3頭のシカが道路を横切りました。","explanationJa":"deerは単複同形で、複数主語なので動詞はcrossedのまま自然です。","focus":"deerの単複同形","difficulty":"intermediate"},{"id":"PAGE_0071_Q17","format":"correct-sentence","prompt":"Choose the correct statement about the word “news.”","choices":{"A":"News always takes a plural verb because it ends in -s.","B":"News must become newses in the plural.","C":"News ends in -s but is normally treated as singular.","D":"News must be preceded by a number."},"correctAnswer":"C","translationJa":"newsは-sで終わりますが通常は単数扱いです。","explanationJa":"語尾の見た目だけで複数と判断しないという注意点を正しく述べています。","focus":"newsの単数扱い","difficulty":"intermediate"},{"id":"PAGE_0071_Q18","format":"correct-sentence","prompt":"Choose the correct statement about plural pronunciation.","choices":{"A":"The plural -s in “reports” is pronounced [s].","B":"The plural -s in “reports” is always pronounced [iz].","C":"Every plural -s in English is pronounced [z].","D":"Plural spelling never affects pronunciation."},"correctAnswer":"A","translationJa":"reportsの複数語尾-sは[s]と発音されます。","explanationJa":"/t/のような無声音の後では-sが[s]となるため正解文が正しいです。","focus":"複数語尾[s]","difficulty":"advanced"},{"id":"PAGE_0071_Q19","format":"correct-sentence","prompt":"Choose the correct statement about the pronunciation of “files.”","choices":{"A":"The final -s in “files” is pronounced [iz].","B":"The final -s in “files” is pronounced [s].","C":"The word “files” has no plural sound.","D":"The final -s in “files” is pronounced [z]."},"correctAnswer":"D","translationJa":"filesの語末-sは[z]と発音されます。","explanationJa":"有声音/l/の後の複数-sは通常[z]です。","focus":"複数語尾[z]","difficulty":"advanced"},{"id":"PAGE_0071_Q20","format":"correct-sentence","prompt":"Choose the correct statement about the pronunciation of “badges.”","choices":{"A":"The plural ending in “badges” is pronounced [iz].","B":"The plural ending in “badges” is pronounced [s].","C":"The plural ending in “badges” is silent.","D":"The plural ending in “badges” is pronounced [z] without an added syllable."},"correctAnswer":"A","translationJa":"badgesの複数語尾は[iz]と発音されます。","explanationJa":"発音しやすくするため1音節を足す[iz]の型です。","focus":"複数語尾[iz]","difficulty":"advanced"},{"id":"PAGE_0071_Q21","format":"meaning-equivalent","prompt":"“Three cities submitted bids.” means the same as:","choices":{"A":"One city submitted three bids.","B":"Three separate cities submitted bids.","C":"Three citys submitted bids.","D":"City was used as an uncountable noun."},"correctAnswer":"B","translationJa":"3つの別々の都市が入札を提出しました。","explanationJa":"citiesはcityの正しい複数形で、3都市を数える意味を保つ正解文が同義です。","focus":"citiesの複数意味","difficulty":"basic"},{"id":"PAGE_0071_Q22","format":"meaning-equivalent","prompt":"“The warehouse has four shelves.” means the same as:","choices":{"A":"Shelf is being used as an uncountable noun.","B":"There is one shelf in the warehouse.","C":"There are four shelfs as the standard spelling.","D":"There are four shelf units in the warehouse."},"correctAnswer":"D","translationJa":"倉庫には棚が4つあります。","explanationJa":"shelvesはshelfの複数形なので正解文が意味を